{
  "$schema": "https://json-schema.org/draft/2020-12/schema",
  "$id": "https://sumonoodle.github.io/datsun-620/schema/run-log.schema.json",
  "title": "Daily run log",
  "description": "Outcome of one daily pipeline run: per-source health plus summary stats. Feeds the digest's source-health section.",
  "type": "object",
  "required": [
    "date",
    "started_at",
    "sources",
    "totals"
  ],
  "additionalProperties": false,
  "properties": {
    "date": {
      "type": "string",
      "format": "date"
    },
    "started_at": {
      "type": "string",
      "format": "date-time"
    },
    "sources": {
      "type": "array",
      "items": {
        "type": "object",
        "required": [
          "source",
          "ok",
          "records"
        ],
        "additionalProperties": false,
        "properties": {
          "source": {
            "type": "string"
          },
          "ok": {
            "type": "boolean"
          },
          "records": {
            "type": "integer",
            "minimum": 0
          },
          "note": {
            "type": "string",
            "description": "Why a source was skipped or failed. Empty when ok."
          },
          "consecutive_failures": {
            "type": "integer",
            "minimum": 0,
            "description": "Days in a row this source has failed; drives the 7-day escalation rule for Japan sources."
          },
          "consecutive_zero_runs": {
            "type": "integer",
            "minimum": 0,
            "description": "Days in a row this source completed OK but returned no listings. A failing run carries the count forward unchanged rather than adding to it. Drives the silent-source alert: eBay reported ok/0 for a month before anyone noticed."
          },
          "expected_blocked": {
            "type": "boolean",
            "description": "True for a source blocked by design rather than broken by accident (an IP-level ban whose real route is the Phase C email alerts). Excluded from the 'sources ok' headline and reported separately, so two permanent bans stop making every healthy run read as a partial failure."
          }
        }
      }
    },
    "totals": {
      "type": "object",
      "required": [
        "active",
        "by_country",
        "median_gbp"
      ],
      "additionalProperties": false,
      "properties": {
        "active": {
          "type": "integer",
          "minimum": 0
        },
        "by_country": {
          "type": "object",
          "additionalProperties": {
            "type": "integer"
          }
        },
        "median_gbp": {
          "type": [
            "number",
            "null"
          ]
        }
      }
    }
  }
}
