{
  "date": "2026-10-28",
  "started_at": "2026-10-28T05:43:26+00:00",
  "sources": [
    {
      "source": "ebay",
      "ok": true,
      "records": 0,
      "note": "",
      "consecutive_failures": 0,
      "consecutive_zero_runs": 39
    },
    {
      "source": "bringatrailer",
      "ok": true,
      "records": 1,
      "note": "",
      "consecutive_failures": 0,
      "consecutive_zero_runs": 0
    },
    {
      "source": "carsandbids",
      "ok": false,
      "records": 0,
      "note": "no JSON API and no embedded state found (needs JS rendering?)",
      "consecutive_failures": 108,
      "consecutive_zero_runs": 0,
      "expected_blocked": true
    },
    {
      "source": "hemmings",
      "ok": false,
      "records": 0,
      "note": "HTTP 403 (bot protection / blocked)",
      "consecutive_failures": 108,
      "consecutive_zero_runs": 0,
      "expected_blocked": true
    },
    {
      "source": "goonet_exchange",
      "ok": true,
      "records": 0,
      "note": "",
      "consecutive_failures": 0,
      "consecutive_zero_runs": 12
    },
    {
      "source": "carsensor",
      "ok": true,
      "records": 1,
      "note": "",
      "consecutive_failures": 0,
      "consecutive_zero_runs": 0
    },
    {
      "source": "yahoo_auctions",
      "ok": true,
      "records": 0,
      "note": "",
      "consecutive_failures": 0,
      "consecutive_zero_runs": 5
    },
    {
      "source": "kaidee",
      "ok": false,
      "records": 0,
      "note": "all Kaidee queries failed (datsun: __NEXT_DATA__ missing (page layout changed or blocked?))",
      "consecutive_failures": 37,
      "consecutive_zero_runs": 0,
      "expected_blocked": false
    },
    {
      "source": "truck2hand",
      "ok": true,
      "records": 4,
      "note": "",
      "consecutive_failures": 0,
      "consecutive_zero_runs": 0
    },
    {
      "source": "classiccars",
      "ok": true,
      "records": 2,
      "note": "",
      "consecutive_failures": 0,
      "consecutive_zero_runs": 0
    },
    {
      "source": "kijiji",
      "ok": true,
      "records": 0,
      "note": "",
      "consecutive_failures": 0,
      "consecutive_zero_runs": 39
    },
    {
      "source": "barnfinds",
      "ok": true,
      "records": 2,
      "note": "",
      "consecutive_failures": 0,
      "consecutive_zero_runs": 0
    },
    {
      "source": "flex",
      "ok": true,
      "records": 0,
      "note": "",
      "consecutive_failures": 0,
      "consecutive_zero_runs": 39
    },
    {
      "source": "kuruma_ex",
      "ok": true,
      "records": 2,
      "note": "",
      "consecutive_failures": 0,
      "consecutive_zero_runs": 0
    },
    {
      "source": "everycar",
      "ok": true,
      "records": 0,
      "note": "",
      "consecutive_failures": 0,
      "consecutive_zero_runs": 38
    },
    {
      "source": "pistonheads",
      "ok": true,
      "records": 0,
      "note": "",
      "consecutive_failures": 0,
      "consecutive_zero_runs": 39
    },
    {
      "source": "ratsun",
      "ok": true,
      "records": 1,
      "note": "",
      "consecutive_failures": 0,
      "consecutive_zero_runs": 0
    },
    {
      "source": "retrorides",
      "ok": true,
      "records": 1,
      "note": "",
      "consecutive_failures": 0,
      "consecutive_zero_runs": 0
    },
    {
      "source": "trovit",
      "ok": true,
      "records": 1,
      "note": "",
      "consecutive_failures": 0,
      "consecutive_zero_runs": 0
    },
    {
      "source": "kleinanzeigen",
      "ok": true,
      "records": 0,
      "note": "",
      "consecutive_failures": 0,
      "consecutive_zero_runs": 39
    }
  ],
  "totals": {
    "active": 15,
    "by_country": {
      "US": 6,
      "TH": 5,
      "GB": 1,
      "JP": 3
    },
    "median_gbp": 4036.33
  }
}
