{
  "date": "2026-10-20",
  "started_at": "2026-10-20T04:52:53+00:00",
  "sources": [
    {
      "source": "ebay",
      "ok": true,
      "records": 4,
      "note": "",
      "consecutive_failures": 0,
      "consecutive_zero_runs": 0
    },
    {
      "source": "bringatrailer",
      "ok": true,
      "records": 0,
      "note": "",
      "consecutive_failures": 0,
      "consecutive_zero_runs": 2
    },
    {
      "source": "classiccars",
      "ok": true,
      "records": 2,
      "note": "",
      "consecutive_failures": 0,
      "consecutive_zero_runs": 0
    },
    {
      "source": "kijiji",
      "ok": true,
      "records": 3,
      "note": "",
      "consecutive_failures": 0,
      "consecutive_zero_runs": 0
    },
    {
      "source": "barnfinds",
      "ok": true,
      "records": 2,
      "note": "",
      "consecutive_failures": 0,
      "consecutive_zero_runs": 0
    },
    {
      "source": "pistonheads",
      "ok": true,
      "records": 0,
      "note": "",
      "consecutive_failures": 0,
      "consecutive_zero_runs": 25
    },
    {
      "source": "retrorides",
      "ok": true,
      "records": 0,
      "note": "",
      "consecutive_failures": 0,
      "consecutive_zero_runs": 25
    },
    {
      "source": "trovit",
      "ok": true,
      "records": 3,
      "note": "",
      "consecutive_failures": 0,
      "consecutive_zero_runs": 0
    },
    {
      "source": "kleinanzeigen",
      "ok": true,
      "records": 1,
      "note": "",
      "consecutive_failures": 0,
      "consecutive_zero_runs": 0
    },
    {
      "source": "goonet_exchange",
      "ok": true,
      "records": 0,
      "note": "",
      "consecutive_failures": 0,
      "consecutive_zero_runs": 25
    },
    {
      "source": "carsensor",
      "ok": false,
      "records": 0,
      "note": "Server error '503 Service Temporarily Unavailable' for url 'https://www.carsensor.net/usedcar/freeword/%E3%83%8F%E3%82%A4%E3%83%A9%E3%83%83%E3%82%AF%E3%82%B9/index.html?YMAX=1989'\nFor more information",
      "consecutive_failures": 3,
      "consecutive_zero_runs": 22,
      "expected_blocked": false
    },
    {
      "source": "yahoo_auctions",
      "ok": true,
      "records": 0,
      "note": "",
      "consecutive_failures": 0,
      "consecutive_zero_runs": 23
    },
    {
      "source": "truck2hand",
      "ok": true,
      "records": 0,
      "note": "",
      "consecutive_failures": 0,
      "consecutive_zero_runs": 25
    },
    {
      "source": "flex",
      "ok": true,
      "records": 0,
      "note": "",
      "consecutive_failures": 0,
      "consecutive_zero_runs": 25
    },
    {
      "source": "kuruma_ex",
      "ok": true,
      "records": 0,
      "note": "",
      "consecutive_failures": 0,
      "consecutive_zero_runs": 25
    },
    {
      "source": "everycar",
      "ok": false,
      "records": 0,
      "note": "timed out",
      "consecutive_failures": 1,
      "consecutive_zero_runs": 24,
      "expected_blocked": false
    },
    {
      "source": "classic_trader",
      "ok": true,
      "records": 0,
      "note": "",
      "consecutive_failures": 0,
      "consecutive_zero_runs": 25
    },
    {
      "source": "gumtree_uk",
      "ok": true,
      "records": 0,
      "note": "",
      "consecutive_failures": 0,
      "consecutive_zero_runs": 25
    },
    {
      "source": "gumtree_za",
      "ok": false,
      "records": 0,
      "note": "Client error '403 Forbidden' for url 'https://www.gumtree.co.za/s-cars-bakkies/toyota~hilux~petrol/v1c9077a3mamofup1'\nFor more information check: https://developer.mozilla.org/en-US/docs/Web/HTTP/Stat",
      "consecutive_failures": 8,
      "consecutive_zero_runs": 0,
      "expected_blocked": false
    },
    {
      "source": "tcv",
      "ok": true,
      "records": 0,
      "note": "",
      "consecutive_failures": 0,
      "consecutive_zero_runs": 25
    },
    {
      "source": "carfromjapan",
      "ok": true,
      "records": 0,
      "note": "",
      "consecutive_failures": 0,
      "consecutive_zero_runs": 25
    },
    {
      "source": "goonet",
      "ok": false,
      "records": 0,
      "note": "all Goo-net Hilux pages failed (https://www.goo-net.com/usedcar/brand-TOYOTA/car-HILUX/model--1-10104114/: timed out)",
      "consecutive_failures": 2,
      "consecutive_zero_runs": 23,
      "expected_blocked": false
    },
    {
      "source": "marktplaats",
      "ok": true,
      "records": 1,
      "note": "",
      "consecutive_failures": 0,
      "consecutive_zero_runs": 0
    },
    {
      "source": "hagerty",
      "ok": true,
      "records": 0,
      "note": "",
      "consecutive_failures": 0,
      "consecutive_zero_runs": 25
    }
  ],
  "totals": {
    "active": 21,
    "by_country": {
      "US": 13,
      "CA": 5,
      "DE": 1,
      "NL": 1,
      "ZA": 1
    },
    "median_gbp": 16707.67
  }
}
